soma_joinid,doi,title,method_headers
1346,10.1016/j.xcrm.2024.101556,Transcriptomic and spatial dissection of humanex vivoright atrial tissue reveals proinflammatory microvascular changes in ischemic heart disease,"[""Key resources table"", ""Resource availability"", ""Experimental model and study participant details"", ""Method details"", ""Quantification and statistical analysis""]"
1351,10.1016/j.jcmgh.2022.02.007,A Proximal-to-Distal Survey of Healthy Adult Human Small Intestine and Colon Epithelium by Single-Cell Transcriptomics,"[""Donor Selection"", ""Tissue Processing"", ""Sample Preparation"", ""Immunofluorescence and In Situ Hybridization"", ""Data Preparation and Hashtag Calling"", ""Data Processing, Filtering, Doublet Removal, and Feature Selection"", ""Identifying Transcriptionally Distinct Subclusters"", ""Online Databases"", ""Trajectory Analysis"", ""Differential Expression Analysis""]"
1369,10.1016/j.cell.2024.07.041,Thyroid hormone remodels cortex to coordinate body-wide metabolism and exploration,"[""RESOURCE AVAILABILITY"", ""EXPERIMENTAL MODEL AND STUDY PARTICIPANT DETAILS"", ""METHOD DETAILS"", ""QUANTIFICATION AND STATISTICAL ANALYSIS""]"
1389,10.1101/2023.12.26.573390,Single-cell transcriptional mapping reveals genetic and non-genetic determinants of aberrant differentiation in AML,"[""Biological Samples:"", ""Computational Analyses:""]"
1397,10.1038/s42003-024-07315-x,Cross-species single-cell RNA-seq analysis reveals disparate and conserved cardiac and extracardiac inflammatory responses upon heart injury,"[""Mouse maintenance"", ""Mouse LAD ligation procedure"", ""Echocardiography"", ""Venipuncture mouse blood collection"", ""Mouse tissues single cell isolation"", ""Mouse cardiac macrophages isolation"", ""Mouse single cell-RNA sequencing"", ""Mouse RNA extraction and qPCR analysis"", ""Histology and immunostaining for mouse samples"", ""White blood cell counts"", ""Flow cytometry and cell sorting for mouse samples"", ""IPA analysis"", ""Zebrafish maintenance"", ""Zebrafish cell isolation and single cell-RNA sequencing"", ""scRNA-seq analysis"", ""Cross-species comparisons"", ""Zebrafish histology and microscopy"", ""Statistics and reproducibility"", ""Reporting summary""]"
1413,10.1016/j.cell.2022.12.010,Molecular and spatial signatures of mouse brain aging at single-cell resolution,"[""RESOURCE AVAILABILITY"", ""EXPERIMENTAL MODEL AND SUBJECT DETAILS"", ""METHOD DETAILS"", ""MERFISH IMAGING"", ""QUANTIFICATION AND STATISTICAL ANALYSIS""]"
1427,10.1016/j.cell.2021.04.048,Integrated analysis of multimodal single-cell data,"[""Key resources table"", ""Resource availability"", ""Experimental model and subject details"", ""Method details"", ""Quantification and statistical analysis""]"
1446,10.1038/s41597-025-04381-6,Integrated cancer cell-specific single-cell RNA-seq datasets of immune checkpoint blockade-treated patients,"[""Data sources"", ""Data curation and standardization"", ""Quality control"", ""Merging"", ""Pre-processing"", ""Data preparation and analysis"", ""Deposit datasets and scripts""]"
1467,10.1038/s41586-021-04345-x,Local and systemic responses to SARS-CoV-2 infection in children and adults,"[""Study participants and design"", ""Sample collection"", ""Nasal and tracheal brushing tissue dissociation"", ""PBMC isolation from peripheral blood"", ""CITE-seq staining for single-cell proteogenomics"", ""Library generation and sequencing"", ""Single-cell RNA-seq computational pipelines, processing and analysis"", ""Metagenomics analysis"", ""Confocal microscopy method"", ""Airway single-cell RNA-seq data processing"", ""CITE-seq data processing"", ""Reporting summary""]"
1480,10.1038/s42255-022-00657-y,HypoMap—a unified single-cell gene expression atlas of the murine hypothalamus,"[""Dataset download"", ""Sequence alignment, UMI and gene count"", ""Dataset quality control"", ""Batch identification"", ""Doublet removal"", ""Data integration"", ""Cluster detection"", ""Marker gene detection"", ""Cluster annotation"", ""Region annotation"", ""Mapping of new data"", ""NucSeq comparative analysis"", ""Experimental methods"", ""Statistics"", ""Reporting summary""]"
1485,10.1038/s42255-023-00876-x,Delineating mouse β-cell identity during lifetime and in diabetes with a single cell atlas,"[""Generation of new mouse samples included in the atlas"", ""Datasets included in the atlas"", ""Datasets for atlas validation"", ""Preprocessing of datasets for atlas building"", ""Ambient gene identification"", ""Dataset quality control"", ""Dataset-wise cell annotation"", ""Batch-wise preprocessing for integration"", ""Integration selection"", ""Integration evaluation with Moran’s I conservation"", ""The final annotation of the integrated atlas"", ""Identification of endocrine cell type markers"", ""Comparison of embryonic and postnatal endocrine cells"", ""Reference mapping of the external mouse dataset"", ""Comparison of diabetes models to human T1D and T2D"", ""Coarse β-cell states and their markers"", ""Gene programs in β-cells"", ""Fine β-cell states"", ""Conserved β-cell heterogeneity in healthy samples"", ""Differential expression in T1D model and T2D model β-cells"", ""Differential expression in T1D model and T2D model endocrine cells"", ""Sex differences in β-cells during aging"", ""Laboratory validation of diabetes markers"", ""Reporting summary""]"
1487,10.1038/s41467-023-40173-5,Guided construction of single cell reference for human and mouse lung,"[""Ethical approval"", ""Collection and pre-processing of single cell/single nucleus RNA-seq of human lung"", ""Mice and Drop-seq of mouse lung development"", ""Guided construction of single-cell reference"", ""Construction of the LungMAP Human Lung CellRef"", ""Construction of the LungMAP Mouse Lung Development CellRef"", ""Automated CellRef annotation of scRNA-seq of normal and diseased human lung"", ""Evaluation of automated CellRef annotation based on prior knowledge"", ""Evaluation of automated CellRef cell type annotation using original annotations of published scRNA-seq data"", ""Evaluation of CellRef cell type annotations using 10-fold cross validation"", ""Cell type stability analysis"", ""Assessment of cell type identity mapping between CellRef and HLCA using pseudo-bulk-based correlation analysis"", ""Marker-based assessment of cell type accuracy using receiver operator characteristics (ROC) analysis"", ""Assessment of single-cell data integration using the Local Inverse Simpson’s Index (LISI) metrics"", ""Statistical analysis"", ""Reporting summary""]"
1504,10.1016/j.cell.2022.01.012,A blood atlas of COVID-19 defines hallmarks of disease severity and specificity,"[""Key resources table"", ""Resource availability"", ""Experimental model and subject details"", ""Method details"", ""Quantification and statistical analysis""]"
1507,10.1038/s41586-021-03852-1,Cells of the human intestinal tract mapped across space and time,"[""Patient samples"", ""Mouse samples"", ""Isolation of intestinal cells from fetal tissue"", ""Isolation of intestinal cells from adult tissue"", ""MACS enrichment"", ""Organoid culture"", ""RNA extraction, reverse transcription and quantitative PCR"", ""10x Genomics Chromium GEX library preparation and sequencing"", ""V(D)J sample preparation"", ""Plate-based Smart-seq2"", ""Pre-processing of 10x Genomics scRNA-seq data"", ""scRNA-seq quality control and processing of 10x sequencing data"", ""Cell-type annotation"", ""Cell-type scoring"", ""Intestinal organoid analysis"", ""Pre-processing and analysis of Smart-seq2 sequencing data"", ""Differential cell-state abundance analysis for BEST4 cells"", ""RNA velocity and diffusion map pseudotime analyses"", ""BCR analysis"", ""Cell–cell communication analysis"", ""Gene expression linked to enteric nervous system disease"", ""Cell-type composition analysis using metadata"", ""Cell-type enrichment analysis for IBD-GWAS genes"", ""Visium spatial transcriptomics sample preparation"", ""10x Genomics Visium data processing"", ""Spatial mapping of cell types with cell2location"", ""Cryosectioning, single-molecule fluorescence in situ hybridization and confocal imaging"", ""Flow cytometry validation of Fcgr on mice tuft cells"", ""Reporting summary""]"
1509,10.1038/s41591-023-02327-2,An integrated cell atlas of the lung in health and disease,"[""Ethics approval and consent"", ""Single-cell sequencing and preprocessing of data"", ""HLCA core data collection"", ""Metadata collection (HLCA core)"", ""General data preprocessing for the HLCA core"", ""Total count normalization with SCRAN"", ""Cell type reference creation and metadata harmonization"", ""Data integration benchmarking"", ""Splitting of studies into datasets"", ""Integration of HLCA core datasets with scANVI"", ""UMAP embedding and clustering"", ""Calculating cluster entropy of cell type labels and donors"", ""Thresholds for high label/donor entropy and doublet clusters"", ""Rare cell type analysis"", ""Manual cell type annotation"", ""Marker gene selection"", ""Variance between individuals explained by covariates"", ""Covariate dependence for interindividual variance"", ""Finding the minimum number of samples for variance modeling"", ""Cell type filtering covariate encoding for gene-level modeling"", ""Modeling gene-level interindividual variation and GSEA"", ""Mapping of GWAS results to the HLCA cell types"", ""Generating cell type signature matrices for deconvolution"", ""Deconvolution of bulk expression data using the HLCA core"", ""Extension of the HLCA core by mapping of new data"", ""Gene name harmonization"", ""Identification of genes associated with common batch effects"", ""Cell type label transfer from the HLCA core to new datasets"", ""Calibration of uncertainty cutoff for classifying as unknown"", ""Identifying clusters with spatially annotated cell types"", ""Disease signature score calculation"", ""Cross-dataset analysis of IPF-associated cell states"", ""Multidisease analysis"", ""Version information"", ""Reporting summary""]"
1511,10.1126/scitranslmed.abh2624,Type I interferon autoantibodies are associated with systemic immune alterations in patients with COVID-19,"[""Study design"", ""Isolation and preparation of PBMCs for scRNA-seq"", ""Single-cell multimodal immunophenotyping"", ""Single-cell library preparation and sequencing"", ""Genotyping, sample demultiplexing, and doublet detection"", ""Bulk RNA sequencing"", ""Single-cell epitope and RNA-seq preprocessing and alignment"", ""Single-cell epitope and RNA-seq processing and quality control"", ""Cell type classification"", ""Differential proportion and expression analysis"", ""Differential expression heatmaps"", ""ISG score method"", ""Flow cytometry validation of elevated surface LAIR1 in cMs for patients with COVID-19"", ""SARS-CoV-2 detection by clinical RT quantitative PCR"", ""RLBA for anti–IFN-α2 autoantibody detection"", ""Luciferase reporter assays"", ""Statistical analysis""]"
1514,10.1038/s41586-021-03910-8,An atlas of cortical arealization identifies dynamic molecular signatures,"[""Sample acquisition"", ""Single-cell RNA sequencing capture and processing"", ""Quality control and filtering"", ""Clustering strategy"", ""Hierarchical clustering of clusters"", ""Constellation plots"", ""Quantification of constellation plots"", ""Module eigengene calculations"", ""Area-specific markers and gene score calculations"", ""Transcription factor annotation"", ""Gene signature overlap and Sankey diagrams"", ""RNA velocity"", ""Validation marker gene selection"", ""Rebus Esper spatial ‘omics platform"", ""Kernel density estimation plots"", ""Spatial co-expression analysis"", ""Reporting summary""]"
1517,10.1038/s41591-021-01329-2,Single-cell multi-omics analysis of the immune response in COVID-19,"[""Ethics and sample collection"", ""Clinical status assignment"", ""PBMC isolation and dead cell removal"", ""TotalSeq-C antibody staining and 10x Chromium loading"", ""Library preparation and sequencing"", ""Alignment and quantification"", ""Doublet identification"", ""CITE-seq background signal removal"", ""Quality control, normalization, embedding and clustering"", ""Cluster differential abundance testing"", ""Relative importance of metadata on cell type composition"", ""Cydar analysis"", ""Comparisons of PBMC annotation using the Azimuth tool"", ""Interferon, TNF and JAK–STAT response scoring"", ""kBET analysis"", ""Bronchoalveolar lavage data analysis"", ""PAGA analysis of blood monocytes and BAL macrophages"", ""CellphoneDB"", ""Platelet activation"", ""HSPC commitment scoring"", ""Multiplex cytokine analysis"", ""Restimulation of PBMCs with SARS-Cov-2 peptide S"", ""Flow cytometry of stimulated cells"", ""GSEA analysis"", ""T cell clustering, annotation and visualization"", ""T cell differential gene expression analysis"", ""T cell receptor analysis"", ""Differential correlation analysis"", ""BCR V(D)J analysis"", ""BCR preprocessing"", ""BCR filtering"", ""B cell clone/clonotype definition"", ""B cell clone/clonotype network"", ""Definition of BCR convergence across participants"", ""Reporting Summary""]"
1545,10.1016/j.ccell.2022.10.008,High-resolution single-cell atlas reveals diversity and plasticity of tissue-resident neutrophils in non-small cell lung cancer,"[""Key resources table"", ""Resource availability"", ""Experimental model and subject details"", ""Method details"", ""Quantification and statistical analysis"", ""Additional resources""]"
1547,10.1016/j.cell.2021.01.053,COVID-19 immune features revealed by a large-scale single-cell transcriptome atlas,"[""Key Resources Table"", ""Resource availability"", ""Experimental model and subject details"", ""Method details"", ""Quantification and statistical analysis""]"
1551,10.1038/s41586-024-08172-8,An integrated transcriptomic cell atlas of human neural organoids,"[""Metadata curation and harmonization of human neural organoid scRNA-seq datasets"", ""Preprocessing of the HNOCA scRNA-seq data"", ""Hierarchical auto-annotation with snapseed"", ""Label-aware data integration with scPoli"", ""Benchmark of data integration methods"", ""Pseudotime inference"", ""Preprocessing of the human developing brain cell atlas scRNA-seq data"", ""Reference mapping of the organoid atlas to the primary atlas"", ""Bipartite weighted kNN graph reconstruction"", ""wkNN-based primary developing brain atlas label transfer to HNOCA cells"", ""Stage-matching analysis"", ""Presence scores and max presence scores of cells in the primary developing brain atlas"", ""Cell type composition comparison among morphogen usage using scCODA"", ""Cell type composition comparison among morphogen usage using regularized linear regression"", ""DE analysis between HNOCA neural cell types and their primary counterparts and functional enrichment analysis"", ""Transcriptomic similarity between HNOCA neural cell types and their primary counterparts in the human developing brain atlas"", ""Heterogeneity of the telencephalic trajectories"", ""Reference mapping of the neural organoid morphogen screen scRNA-seq data to the human developing brain atlas and HNOCA"", ""Retrieval and harmonization of disease-modelling human neural organoid scRNA-seq datasets"", ""Projection and label transfer-based annotation of the disease-modelling dataset"", ""Reconstruction of matched HNOCA metacells"", ""Re-analysis of GBM-2019 and FXS-2021 datasets"", ""F-test-based DE analysis for paired transcriptome"", ""Construction of the HNOCA Community Edition by query-to-reference mapping"", ""Reporting summary""]"
1561,10.1038/s41597-024-04117-y,A multi-region single nucleus transcriptomic atlas of Parkinson’s disease,"[""Cohort data collection"", ""snRNA-seq data generation"", ""Whole-genome sequencing""]"
