soma_joinid,doi,title,method_headers
829,10.1016/j.cell.2020.08.013,Cell Types of the Human Retina and Its Organoids at Single-Cell Resolution,"[""Key Resources Table"", ""Resource Availability"", ""Experimental Model and Subject Details"", ""Method Details"", ""Quantification and Statistical Analysis""]"
842,10.1172/jci.insight.178499,Single-cell RNA-Seq analysis reveals cell subsets and gene signatures associated with rheumatoid arthritis disease activity,"[""Study design."", ""Sample processing and 10X scRNA-Seq."", ""Preprocessing."", ""Compositional analysis."", ""Differential gene expression analysis."", ""Overrepresentation analysis."", ""Cell-cell communication analysis using CellChat."", ""Statistics."", ""Study approval."", ""Data availability.""]"
860,10.1016/j.cell.2021.07.023,Impaired local intrinsic immunity to SARS-CoV-2 infection in severe COVID-19,"[""Key resources table"", ""Resource availability"", ""Experimental model and subject details"", ""Method details"", ""Quantification and statistical analysis""]"
862,10.1093/hmg/ddab140,Human photoreceptor cells from different macular subregions have distinct transcriptional profiles,"[""Experimental model and subject details"", ""Bulk RNA-sequencing of foveal, parafoveal and macular human retina"", ""Computational analysis of bulk RNA-sequencing data"", ""Real time PCR quantification of isoform abundance"", ""Foveal and parafoveal retina scRNA-seq"", ""Computational analysis of scRNA-seq data"", ""Quantification of retinal cell densities"", ""Immunohistochemistry""]"
871,10.1126/sciimmunol.abd1554,Immunophenotyping of COVID-19 and influenza highlights the role of type I interferons in development of severe COVID-19,"[""Patients"", ""Single-cell RNA-seq"", ""Single-cell RNA-seq data processing"", ""Cell type annotation through marker gene identification in each cluster"", ""Reproducibility of biological replicates"", ""Hierarchical clustering of the transcriptomes at cell type resolution"", ""Hierarchical clustering of variable gene expression among disease groups at cell type resolution"", ""Analysis of dynamic changes in cell type composition compared to healthy donors"", ""Identification of DEGs using MAST"", ""Gene Ontology analysis for biological pathways"", ""WGCNA analysis to identify modular gene expression patterns"", ""Subclustering analysis"", ""Trajectory analysis"", ""K-means clustering analysis of monocytes"", ""Data analysis of the transcriptome profiles of post-mortem lung tissues"", ""Enrichment analysis using Enrichr and GSEA 4.0.3"", ""Flow cytometry analysis"", ""ELISA and cytometric bead arrays"", ""Statistical analysis""]"
873,10.1038/s41590-020-0602-z,Distinct microbial and immune niches of the human colon,"[""Colon and mesenteric lymph node tissue retrieval"", ""Tissue dissociation for flow-sorting separation and MAC separation"", ""Flow-sorting"", ""MACS cell enrichment"", ""Tissue dissociation for Ficoll separation"", ""10x Genomics Chromium GEX library preparation and sequencing"", ""10x Genomics Chromium VDJ library preparation and sequencing"", ""Plate-based scRNA-seq"", ""Single-cell RNA sequencing data alignment"", ""Single-cell RNA sequencing quality control"", ""Cell type annotation"", ""‘Pseudospace’ analysis"", ""Sampling of microbiome"", ""Microbiota profiling and sequencing"", ""T cell clonal sharing analysis"", ""Bulk B cell receptor sequencing"", ""10x Genomics single-cell VDJ data processing, quality control and\nannotation"", ""Quantifying IgA binding of bacteria"", ""Genomic DNA Extraction for shotgun sequencing of IgA-bound bacteria"", ""Statistical analysis""]"
893,10.1038/s41467-019-12464-3,Single-cell transcriptomics of human T cells reveals tissue and activation signatures in health and disease,"[""Acquisition of human tissues and blood"", ""T cell isolation and stimulation"", ""Single-Cell RNA-seq"", ""Single-Cell RNA-seq data processing"", ""Computational identification of T cells"", ""Course-grained clustering of T cells from each donor"", ""Blood projection analysis"", ""Comparison of TEM cells from tissue and blood"", ""Analysis of tissue T cell signatures in other datasets"", ""Single-cell hierarchical poisson factorization analysis"", ""Activation trajectory analysis"", ""Flow cytometry and proliferation assays"", ""Quantitative real-time PCR"", ""Tumor-associated T cell projection analysis"", ""Analysis of T cells from dengue virus-infected patients"", ""Reporting summary""]"
938,10.7554/eLife.62522,Single-cell multiomic profiling of human lungs reveals cell-type-specific and age-dynamic control of SARS-CoV2 host genes,"[""Human subjects and tissue collection"", ""Single-nucleus ATAC-seq data generation"", ""Single-nucleus RNA-seq data generation"", ""Single-nucleus RNA-seq analysis"", ""Single-nucleus ATAC-seq analysis"", ""Computing relative accessibility scores"", ""Calculating the relative percent of cells with accessibility at a locus"", ""Associating promoters to candidate distal regulatory elements"", ""Identification and clustering of AT2 peaks with changes in chromatin accessibility genome-wide"", ""Identification of AT2 peaks with changes in chromatin accessibility at candidate gene loci"", ""Annotation of genomic elements"", ""Transcription factor related analyses"", ""Predicting variant effects on TF binding and chromatin accessibility"", ""Phenotype associations for predicted effect variants"", ""Annotating risk variants at the 3p21.31 locus"", ""Deconvoluting lung expression QTLs"", ""Statistics"", ""Code availability""]"
939,10.1016/j.xcrm.2021.100219,A single-cell atlas of the healthy breast tissues reveals clinically relevant clusters of breast epithelial cells,"[""Key Resources Table"", ""Resource availability"", ""Experimental model and subject details"", ""Method details"", ""Quantification and statistical analysis""]"
948,10.1182/bloodadvances.2023011445,Multiomic profiling of human clonal hematopoiesis reveals genotype and cell-specific inflammatory pathway activation∗,"[""Primary patient samples"", ""DNA extraction and CH variant calling"", ""scRNA-seq library preparation"", ""10× single-cell sequencing and data preparation"", ""Single-cell mitochondrial enrichment"", ""Single-cell MT-DNA sequencing, read processing, and variant calling"", ""scDNA-seq via Mission Bio Tapestri"", ""Pipeline processing and variant filtering for Tapestri scDNA-seq"", ""Identification and selection of informative single-cell MT-DNA variants"", ""Differential expression analysis and pathway analysis"", ""Phospho-specific flow cytometry""]"
968,10.1038/s41592-024-02172-2,Generation of complex bone marrow organoids from human induced pluripotent stem cells,"[""Cell culture"", ""Differentiation of BMOs"", ""Cell lines"", ""Mouse strains"", ""Mouse kidney capsule transplantation"", ""Mouse xenotransplantation"", ""Artificial thymic organoid generation"", ""Flow cytometry"", ""Flow cytometry data analysis"", ""BMO dissociation for scRNA-seq"", ""scRNA-seq library preparation and sequencing"", ""scRNA-seq data analysis"", ""CFU assay"", ""Trilineage MSPC differentiation assay"", ""Modeling inflammation"", ""Immunofluorescence"", ""Confocal microscopy"", ""Two-photon microscopy"", ""Image rendering and analysis"", ""Angiotool"", ""Immunohistochemistry"", ""Histology of xenotransplants"", ""Cytospins"", ""Electron microscopy"", ""Data visualization, statistical analysis and reproducibility"", ""Reporting summary""]"
987,10.1016/j.xgen.2023.100298,A multi-omics atlas of the human retina at single-cell resolution,"[""Key resources table"", ""Resource availability"", ""Experimental model and subject details"", ""Method details"", ""Quantification and statistical analysis""]"
998,10.1038/s41467-022-32972-z,Multimodal single cell sequencing implicates chromatin accessibility and genetic background in diabetic kidney disease progression,"[""Human kidney tissue"", ""Statistics and reproducibility"", ""Nuclear dissociation and library preparation"", ""Single nucleus ATAC sequencing and bioinformatics workflow"", ""Single nucleus RNA sequencing and bioinformatics workflow"", ""Single cell analysis of five-prime ends with SCAFE"", ""Cell culture"", ""GR CUT&RUN library preparation and peak calling"", ""Bulk ATAC-seq library preparation and peak calling"", ""CRISPR interference"", ""Quantitative PCR"", ""Bulk RNA-seq analysis of previously published human DKD"", ""Comparison of Cell-specific DAR and GR binding sites to differentially methylated regions in CKD or DKD"", ""Partitioned heritability of ATAC peaks"", ""Allele-specific modeling with SALSA"", ""Reporting summary""]"
1012,10.1186/s13059-019-1906-x,"scRNA-seq assessment of the human lung, spleen, and esophagus tissue stability after cold preservation","[""Aim and study design"", ""Donor samples"", ""Tissue section staining"", ""Tissue dissociation"", ""Library preparation, bulk RNA, and WGS"", ""Computational analysis""]"
1014,10.1038/s44161-022-00183-w,A single-cell comparison of adult and fetal human epicardium defines the age-associated changes in epicardial activity,"[""Adult data collection"", ""Fetal sample collection"", ""hESC-EPI differentiation and collection"", ""RNA-seq pre-processing and processing"", ""Stratified sampling of datasets"", ""Integration of adult and fetal data"", ""Epicardial markers and epicardial markers library"", ""Ligand receptor analysis with CellPhoneDB"", ""Gene–gene co-occurrence and epicardial gene module construction"", ""hESC-EPI analysis and classification"", ""Immunofluorescent staining"", ""Visium slide and library preparation for spatial transcriptomics and Cell2Location"", ""Ethics statement"", ""Reporting summary""]"
1028,10.1016/j.isci.2024.109916,Comprehensive single-cell atlas of the mouse retina,"[""Key resources table"", ""Resource availability"", ""Experimental model and study participant details"", ""Method details"", ""Quantification and statistical analysis""]"
1053,10.1038/s41467-022-35297-z,Single-cell profiling of healthy human kidney reveals features of sex-based transcriptional programs and tissue-specific immunity,"[""Experimental model and subject details"", ""Experimental method details"", ""Gene expression validation studies"", ""Quantification and statistical analysis"", ""Figure preparation"", ""Reporting summary""]"
1064,10.1073/pnas.2121720119,Cellular and transcriptional diversity over the course of human lactation,"[""Donor Enrollment and Breast Milk Collection."", ""Cell Isolation."", ""Generation of scRNA-seq Data with Seq-Well S3."", ""Analysis of scRNA-seq Data.""]"
1065,10.1038/s41467-023-40505-5,Single-cell genomics improves the discovery of risk variants and genes of atrial fibrillation,"[""Data collection"", ""Single-cell genomic data analysis"", ""Defining and classifying open chromatin regions"", ""Comparing snRNA-seq and scATAC-seq"", ""Comparing the cell labels in our study with Litviňuková’s et al."", ""Comparing the OCRs in our study with Hocker et al."", ""Identifying putative TFs regulating chromatin accessibility"", ""SCAVENGE analysis"", ""Testing enrichment of GWAS risk variants in functional annotations"", ""Fine-mapping causal variants in AF-associated loci"", ""Annotating putative AF causal variants with additional functional data"", ""Assessing regulatory effects of candidate variants by Luciferase assay"", ""Gene mapping procedure with Mapgen"", ""Benchmarking performance of different methods for risk gene identification"", ""Gene interaction network analysis"", ""eQTL tissue sharing analysis"", ""Reporting summary""]"
1073,10.1126/science.abl5197,Cross-tissue immune cell analysis reveals tissue-specific features in humans,"[""Tissue acquisition, processing and single-cell sequencing"", ""scRNA-seq and scVDJ-seq data analysis"", ""CellTypist"", ""Single molecule FISH, flow cytometry, qPCR and Immunofluorescence""]"
1076,10.1242/dev.199711,Single-cell transcriptome profiling of the human developing spinal cord reveals a conserved genetic programme with human-specific features,"[""Sample processing"", ""Single-cell RNA sequencing"", ""Quality control and filtering"", ""Cell cycle and gene module scoring"", ""Normalisation, integration and dimension reduction"", ""Cell type classification"", ""Mouse and human correlation analysis"", ""Comparison with bulkin vitroRNA-seq data"", ""Correlation analysis forPAX7"", ""RNA velocity"", ""CellRank trajectory analysis"", ""Immunostaining and microscopy"", ""RNAscope FISH with immunohistochemistry"", ""Image analyses of mouse and human spinal cord sections""]"
1103,10.1038/s41593-021-00872-y,Spatial and cell-type transcriptional landscape of human cerebellar development,"[""Cerebellum samples"", ""Histology, immunohistochemistry, andin situhybridization analyses"", ""Laser capture microdissection"", ""RNA-seq and analysis"", ""Gene co-expression network analyses"", ""BrainSpan RNA-seq data"", ""SPLiT-seq method"", ""snRNA-seq analysis"", ""Cell type deconvolution"", ""Cross-species analysis"", ""Gene set curation"", ""Cell type enrichment analysis"", ""Statistical Tests""]"
1120,10.3390/cells13231991,Transcriptomic Analysis of Air–Liquid Interface Culture in Human Lung Organoids Reveals Regulators of Epithelial Differentiation,"[""2.1. Organoid Culture"", ""2.2. Organoid-Derived Transitional Differentiated Cell Culture"", ""2.3. Sample Preparation for scRNA-Seq"", ""2.4. scRNA-Seq Quality Control, Normalization, and Data Integration"", ""2.5. RNA Velocity and Psudotime Analyses"", ""2.6. Tissue Similarity Evaluation"", ""2.7. Differential Gene Expression Analyses and Further In-Silico Analyses Using iPathwayGuide""]"
1148,10.1016/j.isci.2023.106877,A comprehensive mouse kidney atlas enables rare cell population characterization and robust marker discovery,"[""Key resources table"", ""Resource availability"", ""Method details""]"
1155,10.1016/j.xcrm.2023.101158,Prolonged cytopenia following CD19 CAR T cell therapy is linked with bone marrow infiltration of clonally expanded IFNγ-expressing CD8 T cells,"[""Key resources table"", ""Resource availability"", ""Experimental model and study participant details"", ""Method details"", ""Quantification and statistical analysis""]"
1157,10.1101/2024.10.27.620502,Transcriptional profiles of murine oligodendrocyte precursor cells across the lifespan,"[""Animal care and use"", ""Generation of Matn4-mEGFP mouse line"", ""Immunohistochemistry"", ""Head plate installation and cranial window surgery"", ""In vivo two-photon laser scanning microscopy"", ""Cell Isolation, Enrichment, and cDNA Library Preparation"", ""Data analysis"", ""Immunofluorescence and RNA fluorescence in situ hybridization chain reaction (HCR IF + HCR RNA-FISH)"", ""Image analysis of FISH"", ""Isolation of oligodendrocyte progenitor cells"", ""Culture of adult oligodendrocyte progenitor cells"", ""Imaging and quantification of in vitro pharmacological assays""]"
1161,10.1038/s41467-024-49037-y,Single-cell and spatially resolved interactomics of tooth-associated keratinocytes in periodontitis,"[""Ethics statement"", ""Human integrated periodontitis atlas and mouse keratinocyte atlas generation and analysis"", ""Spatial validation and analysis of keratinocytes"", ""Human primary cell culture and analysis"", ""Statistical methods"", ""Reporting summary""]"
1183,10.1158/2643-3230.BCD-21-0075,Follicular Lymphoma Microenvironment Characteristics Associated with Tumor Cell Mutations and MHC Class II Expression,"[""Sample Collection and Single-Cell Preparation"", ""Single-cell RNA-Library Construction and Sequencing"", ""Single-cell V(D)J Enrichment Library Construction and Sequencing"", ""scRNA-seq Bioinformatics"", ""Whole-Exome Sequencing Data Processing and Genotyping QC"", ""Validation of the scRNA-seq Signatures with a Public scRNA-seq Data Set"", ""lymphoma microenvironment Identification with Public Bulk RNA-seq Data Sets Using Unsupervised Clustering"", ""Deconvolution to Determine Tissue Cell Composition from Pseudobulk Gene-Expression Data"", ""Construction of Immunoglobulin Hierarchy Tree"", ""Statistical Analysis"", ""Multiplex Immunofluorescence Staining and Image Analysis"", ""IHC for HLA-DR"", ""Data Availability""]"
1208,10.1038/s42003-021-02562-8,Identification of distinct tumor cell populations and key genetic mechanisms through single cell sequencing in hepatoblastoma,"[""Human subjects"", ""Animal studies, PDX generation, and monitoring"", ""Immunohistochemisty and second harmonic generation microscopy"", ""Real-time PCR expression and Western blot analysis"", ""Bulk RNA sequencing"", ""Single-cell sequencing and read processing"", ""Preprocessing, integration, and clustering of single-cell data"", ""Tumor cell clustering"", ""RNA velocity"", ""Cell cycle scoring"", ""Transcriptional profile correlation evaluation"", ""Differential gene expression and gene enrichment analysis"", ""Network analysis"", ""Statistical evaluation and reproducibility"", ""Biological material availability"", ""Reporting summary""]"
1213,10.1161/CIRCULATIONAHA.120.051921,Sex-Specific Control of Human Heart Maturation by the Progesterone Receptor,"[""Human Ethics and Tissue Collection"", ""Animal Ethics and Tissue Collection"", ""Cardiac Nuclei Isolation"", ""SnRNA-Seq Library Preparation and Sequencing"", ""PCM1 Cardiomyocyte Nuclei Enrichment, RNA-Seq Library Preparation, and Sequencing"", ""PCM1+ Cardiomyocyte Bulk Assay for Transposase-Accessible Chromatin Sequencing Library Preparation and Sequencing"", ""Bioinformatics Analysis for SnRNA-Seq"", ""PCM1+ Cardiomyocyte Bulk RNA-Seq and ATAC-Seq Bioinformatics Analyses"", ""Human-Induced Pluripotent Stem Cell–Cardiomyocyte Differentiation for ATAC-Seq"", ""Human Embryonic Stem Cell–Derived Cardiomyocyte Differentiation, Extracellular Field Potential, and Impedance Analysis"", ""Human Cardiac Organoid Differentiation and Functional Analysis"", ""Statistical Analysis"", ""Data Access""]"
1216,10.1038/s42255-022-00531-x,Single-cell multi-omics analysis of human pancreatic islets reveals novel cellular states in Type 1 Diabetes,"[""Experimental model and subject details"", ""scRNA-seq islet capture, sequencing, and processing"", ""scRNA-seq clustering, doublet removal, & cell type classification"", ""Differential Gene Expression, GSEA analysis, and Metascape analysis"", ""Hybrid cell co-expression, DE analysis and heatmaps"", ""CyTOF data collection, input files, and preprocessing"", ""TooManyCells clustering for CyTOF"", ""Imaging mass cytometry (IMC) analysis and Cell Segmentation"", ""TooManyCells clustering for IMC"", ""Cell-neighborhood analysis for IMC"", ""Machine-learning method for cell annotation in IMC and CyTOF"", ""IF and confocal microscopy"", ""Statistical analysis of box plots with Control, AAB+, and T1D donor states"", ""Statistical analysis of cellular neighborhoods"", ""Statistical analysis of gene signatures in GAD+ donors"", ""Assessment of common genetic variants associated with T1D""]"
1227,10.1038/s41467-024-45165-7,Single nuclei transcriptomics in human and non-human primate striatum in opioid use disorder,"[""Human individuals"", ""Isolation of nuclei from human postmortem brain tissue and library preparation"", ""Nonhuman primate subjects"", ""Chronic morphine dosing in nonhuman primate subjects"", ""Rhesus brain tissue preparation"", ""Single nucleus RNA sequencing in rhesus brain tissue"", ""Single nuclei RNAseq data processing"", ""Labeling striatum cells with a macaque snRNA reference dataset"", ""Annotating interneurons with mouse marker genes"", ""Differential gene and cellular state expression analysis in humans"", ""Gene set enrichment analyses"", ""Transcription factor-gene regulatory network analyses"", ""Analyses of cellular activation of gene sets"", ""High-dimensional weighted gene co-expression network analysis (hdWGCNA)"", ""Statistical analyses"", ""Reporting summary""]"
1229,10.1084/jem.20232192,Interstitial macrophages are a focus of viral takeover and inflammation in COVID-19 initiation in human lung,"[""Ex vivo culture of human lung tissue"", ""Cell lines"", ""SARS-CoV-2 infections"", ""Plaque assay"", ""Viral inactivation and remdesivir treatment"", ""Single-cell mRNA sequencing"", ""Iterative cell clustering and annotation"", ""Viral takeover analysis"", ""Viral pseudotime analysis"", ""Subgenomic RNA analysis"", ""Immunostaining and single molecule in situ hybridization"", ""Macrophage isolation and enrichment"", ""FACS purification of AMs and IMs"", ""RNA hybridization chain reaction (HCR) and immunofluorescence (IF) staining"", ""Analysis and scoring of infected macrophages"", ""SR microscopy"", ""Pseudotyped lentivirus production"", ""Neutralizing antibodies"", ""Entry and neutralization assays"", ""Statistics and reproducibility"", ""Online supplemental material""]"
1244,10.1016/j.cell.2021.02.018,Time-resolved systems immunology reveals a late juncture linked to fatal COVID-19,"[""Key resources table"", ""Resource availability"", ""Experimental model and subject details"", ""Method details"", ""Quantification and statistical analysis"", ""Data visualization and data table handling""]"
1267,10.1101/2024.11.03.621787,Molecular Signatures of Resilience to Alzheimer’s Disease in Neocortical Layer 4 Neurons,"[""Postmortem brain tissue"", ""Single nuclear isolation and neuronal nuclei enrichment"", ""snRNA-seq of postmortem human brain nuclei"", ""Preprocessing, quality control, and integration of snRNA-seq data"", ""Major cell type, neuronal subtype, and glial cell state annotations"", ""Cell identity prediction using scANVI"", ""Neuronal subtype proportion quantification"", ""Spatial transcriptomics"", ""Integration of snRNA-seq and spatial transcriptomics"", ""Co-expression network analysis"", ""Differential gene expression analysis"", ""Functional enrichment analysis"", ""Immunohistochemistry in human brain tissue"", ""Experimental animals"", ""AAV-driven KCNIP4 expression in excitatory neurons in adult mice"", ""Immunoblotting of mouse cortex tissue"", ""Immunohistochemistry in mouse brain tissue""]"
1292,10.1007/s00401-023-02599-5,Cryptic exon detection and transcriptomic changes revealed in single-nuclei RNA sequencing ofC9ORF72patients spanning the ALS-FTD spectrum,"[""Postmortem tissue samples"", ""Isolation and purification of nuclei"", ""10x Genomics snRNA-seq and sequencing"", ""SnRNA-Seq quality control filtering and normalization"", ""Batch correction and cluster generation"", ""Cluster cell type annotation"", ""Cryptic exon junction analysis"", ""Cryptic exon differential gene expression and pathway analysis"", ""Deeply sequenced subject—C9-FTD 4"", ""Coverage analysis"", ""IGV analysis"", ""Data availability""]"
1322,10.1038/s41590-023-01584-0,Single-cell multiomic analysis of thymocyte development reveals drivers of CD4+T cell and CD8+T cell lineage commitment,"[""Mice"", ""CITE-seq experiment"", ""CITE-seq data preprocessing"", ""totalVI analysis of all CITE-seq data"", ""totalVI analysis of positive selection subset of CITE-seq data"", ""Pseudotime inference"", ""In silico flow cytometry and gating"", ""Adult thymocyte population analysis with fluorescence-based flow cytometry"", ""Differential expression analysis of positively selecting thymocytes with totalVI"", ""Transcription factor enrichment analysis"", ""Neonatal thymic slice experiments"", ""Computational multidimensional analyses of flow cytometry data"", ""In vivo EdU labeling and calcineurin blockade in adult mice"", ""In vitro TCR activation and staining for p-ERK"", ""Statistical analyses"", ""Reporting summary""]"
1324,10.1172/jci.insight.176963,Coordinated immune dysregulation in juvenile dermatomyositis revealed by single-cell genomics,"[""Sex as a biological variable."", ""Study cohort and sample processing."", ""CITEseq of human PBMCs."", ""Sequencing data preprocessing and integration."", ""Cell type proportion analysis."", ""Differential gene and protein expression analysis."", ""Identification of global IFN signature."", ""Network inference from RNA data using DECIPHERseq."", ""Validating signatures in independent data."", ""Statistics."", ""Study approval."", ""Data availability.""]"
1341,10.1038/s41586-023-05769-3,An atlas of healthy and injured cell states and niches in the human kidney,"[""Statistics and reproducibility"", ""Ethical compliance"", ""Single-cell and single-nucleus human tissue samples"", ""Single-cell, single-nucleus and SNARE2 RNA-seq, quality control and clustering"", ""Atlas cell type resolution"", ""Integrating snCv3 and SNARE2 datasets"", ""Integrating snCv3 and scCv3 datasets"", ""Assessment of snCv3, scCv3 and SNARE2 data integration"", ""Integrating snCv3 with published datasets"", ""NSForest marker genes"", ""Correlation analyses"", ""Cross-species alignment of cell types/states"", ""Computing single-nucleus/cell-level expression scores"", ""Gene set enrichment analyses (GSEA)"", ""SNARE2 accessible chromatin analyses"", ""DAR analyses"", ""Transcription factor analyses"", ""Ligand–receptor interaction analyses"", ""GWAS analyses"", ""Disease-associated gene set enrichment analyses"", ""Patient cohorts used for clinical association analyses"", ""Clinical association of cell state scores"", ""Sample-level analysis and clustering on clinical association gene sets"", ""Pseudotime analysis of PT and TAL cells"", ""Gene module detection and cell assignment"", ""RNA velocity analyses"", ""GRN analyses"", ""SLIDE-seq2"", ""10x Visium spatial transcriptomics"", ""Label-free and multifluorescence large-scale 3D imaging"", ""Confocal immunofluorescence microscopy"", ""In situ hybridization"", ""Tissue cytometry and in situ cell classification"", ""3D neighbourhood building and representation"", ""Neighbourhood visualization and statistical analysis"", ""Plots and figures"", ""Reporting summary""]"
