soma_joinid,doi,title,method_headers
407,10.1038/s41590-023-01504-2,Conserved transcriptional connectivity of regulatory T cells in the tumor microenvironment informs new combination cancer therapy strategies,"[""Experimental model and mouse details"", ""Expression heat maps"", ""Spatial transcriptomics"", ""Differential expression of tumor areas"", ""Statistics"", ""Reporting summary""]"
417,10.1038/s41467-018-06318-7,Single cell RNA sequencing of human liver reveals distinct intrahepatic macrophage populations,"[""Human liver tissue dissociation"", ""10x sample processing and cDNA library preparation"", ""Sequencing"", ""Cell clustering, differential expression, and pathway analysis"", ""Human/mouse correlation analysis"", ""Flow cytometry/intracellular cytokine staining"", ""Immunohistochemistry and immunofluorescence"", ""Statistical analysis"", ""Code availability""]"
428,10.1111/cpr.13557,High‐resolution single‐cell transcriptomic survey of cardiomyocytes from patients with hypertrophic cardiomyopathy,"[""Human heart samples"", ""Human cardiomyocyte‐enriched digestion"", ""Single‐cellRNA‐seq library preparation and sequencing"", ""Immunofluorescence staining"", ""Processing of single‐cellRNA‐seq data"", ""Quality control of single‐cellRNA‐seq data"", ""Cell clustering and batch correction"", ""Differential expression analysis"", ""Enrichment analysis andGSEAanalysis"", ""Single‐cell regulatory network inference and clustering (SCENIC) analysis"", ""Gene module score analysis"", ""Analysis of co‐expression gene module"", ""Ligand‐receptoranalysis""]"
451,10.1038/s41467-021-23949-5,Single cell derived mRNA signals across human kidney tumors,"[""Ethics statement"", ""Tissue processing and data generation"", ""Basic data processing and quality control"", ""Analysis of processed data"", ""Method to quantify single cell-derived signals in bulk transcriptomes"", ""Reporting summary""]"
471,10.1016/j.molmet.2022.101595,A transcriptional cross species map of pancreatic islet cells,"[""Cell sources"", ""Single-cell suspension"", ""Single-cell sequencing"", ""Preprocessing and quality control of scRNA-seq data"", ""Single cell manifolds, clustering and annotation"", ""Gene orthologue mapping"", ""Marker gene detection and comparison"", ""Correlation based-gene sets of human α- and β-cells"", ""Similarity of gene expression patterns"", ""Pathway and transcription factor sources and pathway enrichment"", ""Gene set activation and cell scores"", ""Characterization of T1D β-cells"", ""Characterization of fetal human precursor α- and β-cells"", ""Inference of β-cell dynamics using RNA velocity"", ""Cross-species mapping of α- and β-cell states"", ""Mapping of Patch-Seq data to α- and β-cell states"", ""Mapping of 9 publicly available datasets to β-cell states"", ""Data and code availability""]"
486,10.1038/s41593-022-01183-6,CD8+T cells induce interferon-responsive oligodendrocytes and microglia in white matter aging,"[""Animals"", ""Mice perfusion and cell isolation for Smart-seq2"", ""Library preparation for Smart-seq2"", ""Processing, quality control and analyses of Smart-seq2 scRNA-seq data"", ""Mice perfusion and cell isolation for 10× genomic experiments"", ""Library preparation for 10× genomic experiments"", ""Preprocessing and analyses of 10× data"", ""Immunohistochemistry"", ""Correlated light and electron microscopy"", ""Subregional localization analysis"", ""RNAscope in situ hybridization"", ""Cell culture"", ""Stereotactic injection in the corpus callosum"", ""Statistical analysis"", ""Reporting summary""]"
493,10.1073/pnas.2313326120,Multiscale spatial mapping of cell populations across anatomical sites in healthy human skin and basal cell carcinoma,"[""Ethics.""]"
494,10.1371/journal.pbio.3000704,Single-cell mapping reveals new markers and functions of lymphatic endothelial cells in lymph nodes,"[""Ethics statement"", ""Isolation of LN LECs"", ""Single-cell sequencing"", ""Data processing, unsupervised clustering, and DE analyses"", ""Analysis and comparison of previously published human LN LEC data"", ""Immunofluorescence staining"", ""RNA fluorescence in situ hybridization"", ""Flow cytometry analysis"", ""Light sheet microscopy"", ""In vivo LDL tracing assay"", ""Adoptive lymphocyte transfer and tracing"", ""Statistical analysis""]"
498,10.1038/s41467-020-19737-2,Single cell RNA sequencing of human microglia uncovers a subset associated with Alzheimer’s disease,"[""Source of human brain specimens"", ""The ROS and MAP cohorts at RADC"", ""Shipping of brain specimens"", ""Microglia isolation and sorting"", ""10x Genomics chromium single-cell 3′ library construction"", ""Batch structure and sequencing"", ""Single-cell RNA-seq data processing and alignment"", ""Batch correction"", ""Clustering using an iterative PCA-Louvain approach"", ""Identification of a cluster-defining gene sets"", ""Constellation diagram"", ""Dot plot representations"", ""Cluster enrichment by sample condition"", ""Comparison to other RNA-seq data sets"", ""Comparison of single-donor clustering to full clustering"", ""Functional annotation of the different microglia subsets"", ""Disease ontology analysis"", ""Association of clusters with ROSMAP traits"", ""Mapping of single-nuclei data to single-cell clusters"", ""Association of clusters with ROSMAP modules"", ""In situ confirmation of microglia subset abundances"", ""Automated image analysis using CellProfiler"", ""Reporting summary""]"
501,10.1038/s41593-022-01061-1,Single-cell genomic profiling of human dopamine neurons identifies a population that selectively degenerates in Parkinson’s disease,"[""Ethics statement"", ""Animal husbandry ofMus musculus"", ""Cryosectioning and brain preparation"", ""Generation of single-nucleus suspensions from frozen human midbrain and caudate samples"", ""Immunolabeling and blocking of human nuclei"", ""FANS for enrichment of dopaminergic nuclei"", ""Generation of single-nucleus suspensions fromM. musculus"", ""Generation of single-nuclei suspensions fromM. fascicularis,Tupaia belangeriandRattus norvegicus"", ""Generation of Slide-seqV2 libraries fromM. fascicularis"", ""snRNA-seq and library preparation"", ""Hybridization chain reaction on tissue sections"", ""Nissl staining and imaging of macaque midbrain sections"", ""Imaging and analysis of single-molecule FISH experiments testing for differential vulnerability of dopaminergic neurons"", ""Imaging and processing for stereotactic localization of dopaminergic neuron subtypes"", ""Preprocessing of snRNA-seq reads"", ""Preprocessing of Slide-seqV2 sequencing reads"", ""Identification of candidate midbrain dopaminergic neuron TFs for enrichment strategy"", ""Cell type clustering and annotation of human datasets"", ""SCENIC analysis to identify differentially regulated regulons"", ""Robust cell type decomposition analysis of Slide-seqV2 data"", ""Integration of dopaminergic neurons across species"", ""Differential abundance assessment of cell types in association with PD and other covariates"", ""Disease enrichment embedding score"", ""Differential expression analysis"", ""Heritability enrichment analyses"", ""Familial PD variant enrichment analysis"", ""GSEA of TF gene sets across dopamine subtypes"", ""Regression analyses"", ""Statistics and reproducibility"", ""Reporting Summary""]"
505,10.1038/s42003-020-0922-4,Single-cell transcriptomes of the human skin reveal age-related loss of fibroblast priming,"[""Clinical samples"", ""Single-cell RNA sequencing"", ""Data analysis"", ""RNA Fluorescence in situ hybridization (RNA FISH)"", ""Immunohistochemistry (IHC)"", ""Statistics and reproducibility"", ""Reporting summary""]"
513,10.1038/s41467-019-11036-9,Single-cell reconstruction of follicular remodeling in the human adult ovary,"[""Ethical permission and collection of human material"", ""Single-cell dissociation of ovarian tissue"", ""Fluorescence-activated cell sorting (FACS)"", ""RNA-sequencing and primary sequencing analysis"", ""Secondary sequencing analysis"", ""Immunofluorescence"", ""Imaging"", ""C1Q and C3 ELISA on human ovarian tissue"", ""Reporting summary""]"
519,10.1038/s41586-021-03465-8,"Comparative cellular analysis of motor cortex in human, marmoset and mouse","[""Statistics and reproducibility"", ""Ethical compliance"", ""Postmortem human tissue specimens"", ""Human RNA-seq, quality control and clustering"", ""Marmoset sample processing and nuclei isolation"", ""Marmoset RNA-seq, quality control and clustering"", ""Mouse snRNA-seq and snATAC-seq"", ""Integrating and clustering human Cv3 and SSv4 snRNA-seq datasets"", ""Integrating and clustering"", ""Estimation of cell-type homology"", ""Marker determination for cell-type clusters"", ""Calculating DEGs"", ""Differential isoform usage in humans and mice"", ""Species cluster dendrograms"", ""Multiplex FISH and immunofluorescence"", ""Conservation of gene families"", ""Replicability of clusters"", ""SNARE–seq2"", ""Single-cell methylome data (snmC-seq2)"", ""Characterization of chandelier cells"", ""Patch–seq"", ""Reporting summary""]"
534,10.1038/s42003-024-06225-2,Persistent T cell unresponsiveness associated with chronic visceral leishmaniasis in HIV-coinfected patients,"[""Ethics statement"", ""Study population and design"", ""Flow cytometry"", ""Single-cell 5’ RNA and T cell receptor sequencing"", ""Differential gene expression and pathway analysis"", ""T cell receptor repertoire analysis"", ""Statistics and reproducibility"", ""Reporting summary""]"
537,10.1016/j.isci.2023.108572,mRNA COVID-19 vaccine elicits potent adaptive immune response without the acute inflammation of SARS-CoV-2 infection,"[""Key resources table"", ""Resource availability"", ""Experimental model and study participant details"", ""Method details"", ""Quantification and statistical analysis""]"
542,10.1126/science.abo0510,Mapping the developing human immune system across organs*,"[""Tissue acquisition and processing"", ""Single-cell RNA sequencing experiment"", ""ATO cell cultures"", ""Visium"", ""Single-molecule fluorescence in situ hybridization (smFISH)"", ""scRNA-seq analysis"", ""Spatial data analysis"", ""B1 functional validation experiment""]"
546,10.1002/ctm2.1356,Single‐cell RNA sequencing captures patient‐level heterogeneity and associated molecular phenotypes in breast cancer pleural effusions,"[""Patient sample collection"", ""Sample preparation for scRNA‐seq"", ""Data processing for visualizations"", ""Processing of external datasets""]"
557,10.1038/s41467-020-18957-w,Stress-induced RNA–chromatin interactions promote endothelial dysfunction,"[""Cell lines"", ""Cell transfection and stimuli"", ""RNA extraction and quantitative PCR"", ""(Immuno)fluorescent staining"", ""scRNA-seq of HUVECs and data analysis"", ""scRNA-seq of donor-derived arterial ECs and data analysis"", ""Hi-C"", ""iMARGI assay and data analysis"", ""RNA-seq and data analysis"", ""DNA FISH experiment and imaging analysis"", ""RNA FISH experiment and imaging analysis"", ""Subcellular fractionation and RNA isolation"", ""Monocyte adhesion assay"", ""SA-β-gal staining"", ""Statistical analysis"", ""Reporting summary""]"
560,10.1038/s41586-022-05060-x,Spatial multi-omic map of human myocardial infarction,"[""Ethics"", ""Human tissue processing and screening"", ""Spatial gene expression assay"", ""Single-nuclei isolation of human hearts"", ""scRNA-seq"", ""sc-ATAC-seq"", ""RNA in situ hybridization and image quantification"", ""Nuclei quantification of H&E stained Visium slides"", ""Animal model of myocardial infarction"", ""Inducible fate-tracing experiments"", ""Echocardiography"", ""smFISH spot quantification and nuclear segmentation"", ""Masson trichrome staining"", ""Antibodies and immunofluorescence staining"", ""Confocal imaging"", ""Generation of a humanPDGFRB+cardiac cell line"", ""Lentiviral overexpression ofRUNX1"", ""Quantitative PCR with reverse transcription"", ""Preprocessing of snRNA-seq, snATAC-seq and spatial transcriptome data"", ""snRNA-seq data processing"", ""Comparison with independent healthy and ischaemic human heart cell atlases"", ""snATAC-seq data processing"", ""Comparison between snRNA-seq and snATAC-seq data"", ""Cell-type-specific transcription factor binding and regulon activity"", ""Cell-type-specific GWAS signal enrichment"", ""Cell-type-specific integration of snATAC-seq and snRNA-seq data and sub-clustering"", ""Analysis of snRNA-seq data from mouse fibroblasts"", ""Gene-regulatory network inference for cardiomyocytes and fibroblasts"", ""Characterization of spatial transcriptomics datasets"", ""Cell–cell communication analysis"", ""Visualization, statistics, and reproducibility"", ""Reporting summary""]"
591,10.1038/nn.4216,Adult Mouse Cortical Cell Taxonomy by Single Cell Transcriptomics,"[""Data, reagent, and code availability""]"
594,10.1038/s41586-020-2907-3,Phenotypic variation of transcriptomic cell types in mouse motor cortex,"[""Animals"", ""Slice preparation"", ""Patch-seq recording procedures"", ""Experiments at physiological temperature"", ""RNA sequencing of patched cells"", ""Biocytin staining and morphological reconstructions"", ""Cortical thickness normalization and layer assignment"", ""t-Type assignment"", ""Selection of most variable genes"", ""t-SNE visualization of the transcriptomic data"", ""Extraction of electrophysiological features"", ""Extraction of morphological features"", ""Reduced-rank regression"", ""t-SNE visualization of the morpho-electric phenotypes"", ""kNN classification of transcriptomic families"", ""Within-family analysis"", ""T-type variability analysis"", ""Reporting summary""]"
596,10.15252/embj.20105114,SARS‐CoV‐2 receptorACE2 andTMPRSS2 are primarily expressed in bronchial transient secretory cells,"[""Reagents and Tools table"", ""Methods and Protocols"", ""Lung tissues""]"
602,10.1038/s43587-024-00613-3,Human skeletal muscle aging atlas,"[""Experimental methods"", ""Computational methods"", ""Reporting summary""]"
608,10.1016/j.ccell.2022.11.001,Mapping single-cell transcriptomes in the intra-tumoral and associated territories of kidney cancer,"[""Key resources table"", ""Resource availability"", ""Experimental model and subject details"", ""Method details"", ""Quantification and statistical analysis""]"
610,10.1016/j.cell.2021.11.031,Differential pre-malignant programs and microenvironment chart distinct paths to malignancy in human colorectal polyps,"[""RESOURCE AVAILABILITY"", ""EXPERIMENTAL MODEL AND SUBJECTS DETAILS"", ""METHOD DETAILS"", ""QUANTIFICATION AND STATISTICAL ANALYSIS""]"
621,10.1038/s41588-024-01688-9,A single-cell atlas enables mapping of homeostatic cellular shifts in the adult human breast,"[""Human tissues"", ""Batch design"", ""Mammary gland dissociation into single-cell suspension"", ""scRNA-seq"", ""Library preparation and sequencing"", ""Processing and quality control of scRNA-seq data"", ""Clustering and annotation"", ""Differential expression and gene set enrichment analysis"", ""Milo and differential abundance analysis"", ""Cell–cell interactions"", ""Copy number inference"", ""Ultivue InSituPlex staining and imaging"", ""iHBCA"", ""Immunofluorescence staining and analysis"", ""Statistics and reproducibility"", ""Reporting summary""]"
633,10.1038/s41467-024-52052-8,The single-cell transcriptomic atlas iPain identifies senescence of nociceptors as a therapeutical target for chronic pain treatment,"[""Mice"", ""Drug administration"", ""Full blood Count"", ""Chronic constrictive injury mice model"", ""Pain-related behavioral tests"", ""Anxiety and balance motor function-related behavior assessments"", ""Senescence-associated β-galactosidase staining"", ""Immunostaining"", ""Imaging"", ""DRG dissociation and single-nuclei isolation51–53"", ""Fluorescent-activated nuclei sorting and single-nuclei RNA sequencing (Smart-seq3xpress and 10x Multiomic sequencing)"", ""Obtaining and preprocessing the publicly available scRNA-seq data"", ""Preprocessing the lab-generated data"", ""Main UMAP of DRG"", ""Feature imputation"", ""Analysis of the nociceptive lineage cells"", ""Cell state potency"", ""Temporal analysis of nociceptive subtypes"", ""Cell-cell communication"", ""Identification of senescence"", ""Analysis of human DRG RNA-seq within"", ""Analysis of human DRG RNA-seq with diabetic neuropathy"", ""UMAP of TG"", ""Statistical analysis"", ""Reporting summary""]"
635,10.1038/s41586-023-06806-x,A human embryonic limb cell atlas resolved in space and time,"[""Human tissue sample collection"", ""Human tissue processing and scRNA-seq data generation"", ""Mouse tissue sample collection and scRNA-seq data generation"", ""Visium spatial transcriptomic experiments of human tissue"", ""Digit region analysis of Visium data"", ""Alignment, quantification and quality control of scRNA-seq data"", ""Alignment and quantification of human Visium data"", ""Doublet detection of scRNA-seq data"", ""Data preprocessing and integration of scRNA-seq data"", ""Clustering and annotation of scRNA-seq data"", ""Deconvolution of human Visium data using cell2location"", ""Alignment and merging of multiple Visium sections using VisiumStitcher"", ""Trajectory analysis of human scRNA-seq data"", ""RNA velocity calculations for mesenchymal compartment"", ""Cell–cell communication analysis of human scRNA-seq data"", ""Regulon analysis of transcription factors"", ""Integration of human and mouse scRNA-seq data"", ""Immunohistochemistry"", ""RNA-ISH"", ""RNA-ISH colocalization analysis"", ""Light-sheet fluorescence microscopy"", ""The antibodies used for light-sheet fluorescence microscopy"", ""MSCknockdown in human primary myoblasts"", ""Ethics statement"", ""Reporting summary""]"
641,10.1073/pnas.2023333118,"Early role for a Na+,K+-ATPase (ATP1A3) in brain development","[""Human Subjects and Samples."", ""Human Genetics Sequencing and Analysis."", ""Phenotypic Assessment."", ""Human Brain Tissue Preparation and mRNA ISH."", ""Bulk Human Cortex Gene-Expression Analysis."", ""Drop-Seq Isolation and Sequencing."", ""Graphics.""]"
642,10.1182/blood.2021013442,"Single-cell multiomics reveals increased plasticity, resistant populations, and stem-cell–like blasts inKMT2A-rearranged leukemia","[""Human biospecimens"", ""Single-cell RNA sequencing (scRNA-Seq)"", ""Single-cell assay for transposase-accessible chromatin using sequencing (scATAC-Seq)""]"
650,10.1038/s41467-021-22368-w,Single cell transcriptional and chromatin accessibility profiling redefine cellular heterogeneity in the adult human kidney,"[""Tissue procurement"", ""Nuclear dissociation and library preparation"", ""Single nucleus RNA sequencing bioinformatics workflow"", ""Single nucleus ATAC sequencing bioinformatics workflow"", ""Comparison to previously published database of DNase hypersensitive sites"", ""Estimation of transcription factor activity from snATAC-seq data"", ""Generation of cis-coaccessibility networks with Cicero"", ""Construction of pseudotemporal trajectories with Monocle or Cicero"", ""Comparison of Cicero coaccessibility connections to GeneHancer database"", ""Genotyping and variant annotation with GATK pipeline"", ""Allele-specific expression analysis"", ""Gene-ontology enrichment analysis"", ""Gene set enrichment analysis"", ""Deconvolution of bulk RNA-seq data"", ""Inter-species snRNA-seq data comparison"", ""Cell culture"", ""ChIP-qPCR"", ""Immunofluorescence studies"", ""Immunohistochemical staining of tissue for light microscopy"", ""Statistical analysis"", ""Reporting summary""]"
706,10.1038/s41586-022-04918-4,Single-cell roadmap of human gonadal development,"[""Patient samples"", ""Assignment of developmental stage"", ""Tissue processing"", ""Cell sorting"", ""Single-nuclei suspension"", ""Tissue cryopreservation"", ""Tissue freezing"", ""Tissue collection from mouse embryos"", ""Haematoxylin and eosin staining and imaging"", ""Multiplexed smFISH and high-resolution imaging"", ""Image stitching"", ""10X Genomics Chromium GEX (gene expression) library preparation and sequencing"", ""10X Genomics Visium library preparation and sequencing"", ""Alignment and quantification of sc or snRNA-seq data"", ""Downstream scRNA-seq analysis"", ""Alignment, quantification and quality control of ATAC data"", ""Downstream scATAC-seq analysis"", ""Alignment, quantification and quality control of Visium data"", ""Downstream analysis of 10X Genomics Visium data"", ""CellPhoneDB and CellSign"", ""TF analysis"", ""Reporting summary""]"
710,10.1371/journal.pbio.3000152,Single-cell transcriptomics reveals gene expression dynamics of human fetal kidney development,"[""Ethics statement"", ""Experimental methods"", ""Quantification and statistical analysis""]"
725,10.1038/s41586-021-03500-8,A transcriptomic and epigenomic cell atlas of the mouse primary motor cortex,"[""Tissue collection and isolation of cells or nuclei (RNA-seq at the Allen Institute)"", ""Tissue collection and nuclei isolation (RNA-seq at the Broad Institute)"", ""Tissue collection and isolation of nuclei for epigenomic samples"", ""Genomic library preparation, sequencing and data processing"", ""Preprocessing of the DNA methylation (snmC-seq2) data (Salk Institute)"", ""Computational analysis"", ""Transcriptome analysis"", ""MetaNeighbor analysis"", ""Multimodality integration"", ""Analysis of enhancers"", ""Cluster validation analysis"", ""Reporting summary""]"
728,10.1038/s41586-020-2922-4,A molecular cell atlas of the human lung from single cell RNA sequencing,"[""Human lung tissue and peripheral blood"", ""Mouse lung tissue"", ""Isolation of lung and blood cells"", ""Magnetic separation of lung tissue compartments"", ""Flow cytometry and cell sorting"", ""Single cell mRNA sequencing"", ""Immune cell bulk mRNA sequencing"", ""Immunohistochemistry"", ""Single moleculein situhybridization""]"
729,10.1073/pnas.2200914119,Cell atlas of the human ocular anterior segment: Tissue-specific and shared cell types,"[""Tissue Acquisition, Dissection, and Processing."", ""Histology.""]"
731,10.1126/sciimmunol.adf9988,Early human lung immune cell development and its role in epithelial cell fate,"[""Study design"", ""Human lung tissue"", ""Immune cell IHC quantification"", ""Quantification of tissue-resident immune cells"", ""Digestion of human lung tissue and flow cytometry/FACS"", ""scRNA-seq and CITE-seq staining, library construction and sequencing"", ""Single-cell data quantification"", ""Genetic donor demultiplexing"", ""scRNA-seq downstream analyses"", ""Human embryonic lung organoids"", ""Cytokine treatment"", ""Dual SMAD activation (DSA)"", ""Macrophage and DC culture and cytokine array"", ""Statistical analysis""]"
737,10.1038/s41586-022-05496-1,Ovarian cancer mutational processes drive site-specific immune evasion,"[""Experimental methods"", ""Computational methods"", ""Reporting summary""]"
747,10.1016/j.cell.2021.12.018,Spatial proteogenomics reveals distinct and evolutionarily conserved hepatic macrophage niches,"[""Key resources table"", ""Resource availability"", ""Experimental model and subject details"", ""Method details"", ""Quantification and statistical analysis"", ""Additional resources""]"
767,10.1038/s41588-021-00972-2,Mapping the temporal and spatial dynamics of the human endometrium in vivo and in vitro,"[""Uterine tissue retrieval"", ""Endometrial organoid cultures"", ""Hormonal stimulation and inhibition experiment of endometrial organoids"", ""Doublet detection, alignment of data across different batches and clustering of scRNA-seq data"", ""Annotation of scRNA-seq datasets"", ""Efficiency of organoid differentiation"", ""Annotation of organoid data using scRNA-seq in vivo dataset reference"", ""Annotation of snRNA-seq using scRNA-seq in vivo dataset as a reference"", ""Trajectory analysis of organoid data"", ""Cellular signal analysis"", ""Location of cell types in Visium data"", ""Clustering of spots"", ""Calculating TF activities"", ""CellPhoneDB v.3.0"", ""Image stitching and manual annotation of selected glands"", ""smFISH quantification"", ""Reporting Summary""]"
771,10.1111/cas.15979,Single‐cell transcriptomic analysis of gingivo‐buccal oral cancer reveals two dominant cellular programs,"[""Sample collection"", ""Preparation of single‐cell suspension"", ""Single‐cell RNA sequencing library construction and sequencing"", ""Single‐cell RNA sequencing data processing"", ""Identification of malignant cells"", ""Analysis of subclusters within malignant and nonmalignant cell clusters""]"
772,10.3389/fcvm.2020.00052,A Single-Cell Transcriptional Roadmap of the Mouse and Human Lymph Node Lymphatic Vasculature,"[""Mice"", ""Immune Challenge"", ""Tissue Dissociation and Single-Cell Library Preparation"", ""Single-Cell RNA-seq Data Analysis"", ""Nearest Neighbor Alignments in Trajectory Space"", ""Differential Gene Expression and Gene Enrichment Analysis"", ""Correlation Analysis"", ""Cross Species Single-Cell Transcriptome Analysis"", ""Reanalysis of Human LEC Datasets"", ""Immunostaining of Mouse LNs"", ""Immunostaining of Human LNs"", ""Antibodies"", ""RNAin situHybridization"", ""Imaging""]"
779,10.1016/j.devcel.2020.11.010,Single-Cell Sequencing of Developing Human Gut Reveals Transcriptional Links to Childhood Crohn’s Disease,"[""Key Resources Table"", ""Resource Availability"", ""Experimental Model and Subject Details"", ""Method Details"", ""scVelo and PAGA Trajectory Analysis"", ""Quantification and Statistical Analysis""]"
799,10.1016/j.celrep.2022.111838,A molecular atlas of the human postmenopausal fallopian tube and ovary from single-cell RNA and ATAC sequencing,"[""RESOURCE AVAILABILITY"", ""EXPERIMENTAL MODEL AND SUBJECT DETAILS"", ""METHOD DETAILS"", ""QUANTIFICATION AND STATISTICAL ANALYSIS""]"
